{"v":1,"type":"photo.result","id":"22222222-2222-4222-8222-222222222222","seq":8,"ts":1790000001500,"corr":"33333333-3333-4333-8333-333333333333","payload":{"captureId":"11111111-1111-4111-8111-111111111111","mimeType":"image/jpeg","width":1280,"height":960,"bytes":183422,"mediaRef":"s3://media/d1/cap-1.jpg"}}
