{"v":1,"type":"capability.report","id":"22222222-2222-4222-8222-222222222222","seq":1,"ts":1790000000100,"payload":{"capabilities":[{"id":"camera.photo","presence":"PRESENT","source":"BUILTIN","limits":{"maxEdge":4096}},{"id":"mic.input","presence":"PRESENT"},{"id":"speaker.output","presence":"PRESENT"},{"id":"display.hud","presence":"PRESENT","source":"EMULATED","limits":{"lines":1,"chars":32}},{"id":"sensor.heart_rate","presence":"ABSENT"}],"battery":{"percent":80,"charging":false}}}
